{
  "exec": {
    "backend": "native-stdio",
    "stdout": "",
    "stderr": "",
    "exit_code": null,
    "duration_ms": 878
  },
  "mcp_transcript": {
    "events": [
      {
        "direction": "client-to-server",
        "method": "initialize",
        "payload": {
          "id": 1,
          "jsonrpc": "2.0",
          "method": "initialize",
          "params": {
            "capabilities": {},
            "clientInfo": {
              "name": "mcp-sandboxscan",
              "version": "0.1.0"
            },
            "protocolVersion": "2025-06-18"
          }
        }
      },
      {
        "direction": "server-to-client",
        "method": null,
        "payload": {
          "id": 1,
          "jsonrpc": "2.0",
          "result": {
            "capabilities": {
              "logging": {},
              "tools": {
                "listChanged": true
              }
            },
            "protocolVersion": "2025-06-18",
            "serverInfo": {
              "name": "progress-example",
              "version": "1.0.0"
            }
          }
        }
      },
      {
        "direction": "client-to-server",
        "method": "notifications/initialized",
        "payload": {
          "jsonrpc": "2.0",
          "method": "notifications/initialized"
        }
      },
      {
        "direction": "client-to-server",
        "method": "tools/call",
        "payload": {
          "id": 2,
          "jsonrpc": "2.0",
          "method": "tools/call",
          "params": {
            "arguments": {
              "n": 3
            },
            "name": "count"
          }
        }
      },
      {
        "direction": "server-to-client",
        "method": null,
        "payload": {
          "id": 2,
          "jsonrpc": "2.0",
          "result": {
            "content": [
              {
                "text": "Counted to 3",
                "type": "text"
              }
            ]
          }
        }
      }
    ]
  },
  "events": [
    {
      "kind": "mcp-initialize",
      "actor": "mcp-client",
      "target": "initialize",
      "evidence": {
        "id": 1,
        "jsonrpc": "2.0",
        "method": "initialize",
        "params": {
          "capabilities": {},
          "clientInfo": {
            "name": "mcp-sandboxscan",
            "version": "0.1.0"
          },
          "protocolVersion": "2025-06-18"
        }
      }
    },
    {
      "kind": "mcp-tool-call",
      "actor": "mcp-client",
      "target": "tools/call",
      "evidence": {
        "id": 2,
        "jsonrpc": "2.0",
        "method": "tools/call",
        "params": {
          "arguments": {
            "n": 3
          },
          "name": "count"
        }
      }
    },
    {
      "kind": "mcp-tool-result",
      "actor": "mcp-server",
      "target": "count",
      "evidence": {
        "response": {
          "id": 2,
          "jsonrpc": "2.0",
          "result": {
            "content": [
              {
                "text": "Counted to 3",
                "type": "text"
              }
            ]
          }
        },
        "tool_name": "count"
      }
    },
    {
      "kind": "sink-observed",
      "actor": "scanner",
      "target": "mcp-tool-result",
      "evidence": {
        "sink": {
          "path": "$.content[0].text",
          "type": "McpToolResultText",
          "value": "Counted to 3"
        },
        "text_len": 12
      }
    }
  ],
  "sources": [],
  "sinks": [
    {
      "type": "McpToolResultText",
      "path": "$.content[0].text",
      "value": "Counted to 3"
    }
  ],
  "flows": [],
  "summary": {
    "num_sources": 0,
    "num_sinks": 1,
    "num_flows": 0,
    "has_external_to_prompt_flow": false
  }
}