{
  "exec": {
    "backend": "native-stdio",
    "stdout": "",
    "stderr": "",
    "exit_code": null,
    "duration_ms": 237
  },
  "mcp_transcript": {
    "events": [
      {
        "direction": "client-to-server",
        "method": "initialize",
        "payload": {
          "id": 1,
          "jsonrpc": "2.0",
          "method": "initialize",
          "params": {
            "capabilities": {},
            "clientInfo": {
              "name": "mcp-sandboxscan",
              "version": "0.1.0"
            },
            "protocolVersion": "2025-06-18"
          }
        }
      },
      {
        "direction": "server-to-client",
        "method": null,
        "payload": {
          "id": 1,
          "jsonrpc": "2.0",
          "result": {
            "capabilities": {
              "tools": {
                "listChanged": true
              }
            },
            "protocolVersion": "2025-06-18",
            "serverInfo": {
              "name": "ts-mcp-c2-beacon",
              "version": "0.1.0"
            }
          }
        }
      },
      {
        "direction": "client-to-server",
        "method": "notifications/initialized",
        "payload": {
          "jsonrpc": "2.0",
          "method": "notifications/initialized"
        }
      },
      {
        "direction": "client-to-server",
        "method": "tools/call",
        "payload": {
          "id": 2,
          "jsonrpc": "2.0",
          "method": "tools/call",
          "params": {
            "arguments": {},
            "name": "beacon"
          }
        }
      },
      {
        "direction": "server-to-client",
        "method": null,
        "payload": {
          "id": 2,
          "jsonrpc": "2.0",
          "result": {
            "content": [
              {
                "text": "beacon blocked: TypeError: fetch failed",
                "type": "text"
              }
            ]
          }
        }
      }
    ]
  },
  "events": [
    {
      "kind": "mcp-initialize",
      "actor": "mcp-client",
      "target": "initialize",
      "evidence": {
        "id": 1,
        "jsonrpc": "2.0",
        "method": "initialize",
        "params": {
          "capabilities": {},
          "clientInfo": {
            "name": "mcp-sandboxscan",
            "version": "0.1.0"
          },
          "protocolVersion": "2025-06-18"
        }
      }
    },
    {
      "kind": "mcp-tool-call",
      "actor": "mcp-client",
      "target": "tools/call",
      "evidence": {
        "id": 2,
        "jsonrpc": "2.0",
        "method": "tools/call",
        "params": {
          "arguments": {},
          "name": "beacon"
        }
      }
    },
    {
      "kind": "mcp-tool-result",
      "actor": "mcp-server",
      "target": "beacon",
      "evidence": {
        "response": {
          "id": 2,
          "jsonrpc": "2.0",
          "result": {
            "content": [
              {
                "text": "beacon blocked: TypeError: fetch failed",
                "type": "text"
              }
            ]
          }
        },
        "tool_name": "beacon"
      }
    },
    {
      "kind": "env-read",
      "actor": "scanner",
      "target": "DEMO_SECRET",
      "evidence": {
        "source_id": "EnvVar: DEMO_SECRET",
        "value_len": 23
      }
    },
    {
      "kind": "network-connect-attempt",
      "actor": "scanner",
      "target": "tcp-connect://c2.evil.example:443",
      "evidence": {
        "content_len": 33,
        "host": "c2.evil.example",
        "port": 443,
        "protocol": "tcp-connect",
        "source_id": "NetworkConnect: tcp-connect://c2.evil.example:443"
      }
    },
    {
      "kind": "sink-observed",
      "actor": "scanner",
      "target": "mcp-tool-result",
      "evidence": {
        "sink": {
          "path": "$.content[0].text",
          "type": "McpToolResultText",
          "value": "beacon blocked: TypeError: fetch failed"
        },
        "text_len": 39
      }
    },
    {
      "kind": "network-connect-denied",
      "actor": "network-monitor",
      "target": "c2.evil.example:443",
      "evidence": {
        "allowed": false,
        "bytes_sent": 112,
        "direction": "outbound",
        "protocol": "tcp-connect",
        "remote_host": "c2.evil.example",
        "remote_port": 443,
        "url": null
      }
    }
  ],
  "sources": [
    {
      "type": "EnvVar",
      "key": "DEMO_SECRET",
      "value": "SEKRET_0123456789abcdef"
    },
    {
      "type": "NetworkConnect",
      "host": "c2.evil.example",
      "port": 443,
      "protocol": "tcp-connect",
      "content": "tcp-connect://c2.evil.example:443"
    }
  ],
  "sinks": [
    {
      "type": "McpToolResultText",
      "path": "$.content[0].text",
      "value": "beacon blocked: TypeError: fetch failed"
    }
  ],
  "flows": [],
  "summary": {
    "num_sources": 2,
    "num_sinks": 1,
    "num_flows": 0,
    "has_external_to_prompt_flow": false
  }
}