{
  "exec": {
    "backend": "wasm",
    "stdout": "{\"status\":\"ok\",\"message\":\"static benign result\"}\n",
    "stderr": "",
    "exit_code": 0,
    "duration_ms": 1
  },
  "events": [
    {
      "kind": "capability-granted",
      "actor": "wasi-runtime",
      "target": "stdin",
      "evidence": {
        "bytes_len": 21,
        "capability": "stdio",
        "stream": "stdin"
      }
    },
    {
      "kind": "capability-granted",
      "actor": "wasi-runtime",
      "target": "stdout",
      "evidence": {
        "capability": "stdio",
        "max_output_bytes": 8192,
        "stream": "stdout"
      }
    },
    {
      "kind": "capability-granted",
      "actor": "wasi-runtime",
      "target": "stderr",
      "evidence": {
        "capability": "stdio",
        "max_output_bytes": 8192,
        "stream": "stderr"
      }
    },
    {
      "kind": "capability-granted",
      "actor": "wasi-runtime",
      "target": "network-monitor",
      "evidence": {
        "capability": "network-monitor",
        "policy": "deny-by-default",
        "tcp": true,
        "udp": true
      }
    },
    {
      "kind": "sink-observed",
      "actor": "scanner",
      "target": "tool-return",
      "evidence": {
        "sink": {
          "path": "$.message",
          "type": "ToolReturnLeaf",
          "value": "static benign result"
        },
        "text_len": 20
      }
    }
  ],
  "sources": [],
  "sinks": [
    {
      "type": "ToolReturnLeaf",
      "path": "$.message",
      "value": "static benign result"
    }
  ],
  "flows": [],
  "summary": {
    "num_sources": 0,
    "num_sinks": 1,
    "num_flows": 0,
    "has_external_to_prompt_flow": false
  }
}