{
  "exec": {
    "backend": "native-stdio",
    "stdout": "",
    "stderr": "",
    "exit_code": null,
    "duration_ms": 169
  },
  "mcp_transcript": {
    "events": [
      {
        "direction": "client-to-server",
        "method": "initialize",
        "payload": {
          "id": 1,
          "jsonrpc": "2.0",
          "method": "initialize",
          "params": {
            "capabilities": {},
            "clientInfo": {
              "name": "mcp-sandboxscan",
              "version": "0.1.0"
            },
            "protocolVersion": "2025-06-18"
          }
        }
      },
      {
        "direction": "server-to-client",
        "method": null,
        "payload": {
          "id": 1,
          "jsonrpc": "2.0",
          "result": {
            "capabilities": {
              "tools": {}
            },
            "protocolVersion": "2025-06-18",
            "serverInfo": {
              "name": "mcp-claude-hackernews",
              "version": "1.0.0"
            }
          }
        }
      },
      {
        "direction": "client-to-server",
        "method": "notifications/initialized",
        "payload": {
          "jsonrpc": "2.0",
          "method": "notifications/initialized"
        }
      },
      {
        "direction": "client-to-server",
        "method": "tools/list",
        "payload": {
          "id": 2,
          "jsonrpc": "2.0",
          "method": "tools/list",
          "params": {}
        }
      },
      {
        "direction": "server-to-client",
        "method": null,
        "payload": {
          "id": 2,
          "jsonrpc": "2.0",
          "result": {
            "tools": [
              {
                "description": "Get the latest/newest stories from Hacker News",
                "inputSchema": {
                  "properties": {
                    "limit": {
                      "default": 10,
                      "description": "Number of stories to fetch (1-50, default: 10)",
                      "maximum": 50,
                      "minimum": 1,
                      "type": "number"
                    }
                  },
                  "type": "object"
                },
                "name": "hn_latest"
              },
              {
                "description": "Get the top-ranked stories from Hacker News",
                "inputSchema": {
                  "properties": {
                    "limit": {
                      "default": 10,
                      "description": "Number of stories to fetch (1-50, default: 10)",
                      "maximum": 50,
                      "minimum": 1,
                      "type": "number"
                    }
                  },
                  "type": "object"
                },
                "name": "hn_top"
              },
              {
                "description": "Get the best stories from Hacker News",
                "inputSchema": {
                  "properties": {
                    "limit": {
                      "default": 10,
                      "description": "Number of stories to fetch (1-50, default: 10)",
                      "maximum": 50,
                      "minimum": 1,
                      "type": "number"
                    }
                  },
                  "type": "object"
                },
                "name": "hn_best"
              },
              {
                "description": "Get details for a specific story by ID",
                "inputSchema": {
                  "properties": {
                    "story_id": {
                      "description": "The ID of the story to fetch",
                      "type": "number"
                    }
                  },
                  "required": [
                    "story_id"
                  ],
                  "type": "object"
                },
                "name": "hn_story"
              },
              {
                "description": "Get comments for a story (by story ID or index from last story list)",
                "inputSchema": {
                  "properties": {
                    "story_id": {
                      "description": "The ID of the story to get comments for",
                      "type": "number"
                    },
                    "story_index": {
                      "description": "The index (1-based) of the story from the last fetched list",
                      "minimum": 1,
                      "type": "number"
                    }
                  },
                  "type": "object"
                },
                "name": "hn_comments"
              }
            ]
          }
        }
      },
      {
        "direction": "client-to-server",
        "method": "tools/call",
        "payload": {
          "id": 3,
          "jsonrpc": "2.0",
          "method": "tools/call",
          "params": {
            "arguments": {},
            "name": "hn_latest"
          }
        }
      },
      {
        "direction": "server-to-client",
        "method": null,
        "payload": {
          "id": 3,
          "jsonrpc": "2.0",
          "result": {
            "content": [
              {
                "text": "No stories found.",
                "type": "text"
              }
            ]
          }
        }
      }
    ]
  },
  "events": [
    {
      "kind": "mcp-initialize",
      "actor": "mcp-client",
      "target": "initialize",
      "evidence": {
        "id": 1,
        "jsonrpc": "2.0",
        "method": "initialize",
        "params": {
          "capabilities": {},
          "clientInfo": {
            "name": "mcp-sandboxscan",
            "version": "0.1.0"
          },
          "protocolVersion": "2025-06-18"
        }
      }
    },
    {
      "kind": "mcp-tools-list",
      "actor": "mcp-client",
      "target": "tools/list",
      "evidence": {
        "id": 2,
        "jsonrpc": "2.0",
        "method": "tools/list",
        "params": {}
      }
    },
    {
      "kind": "mcp-tool-call",
      "actor": "mcp-client",
      "target": "tools/call",
      "evidence": {
        "id": 3,
        "jsonrpc": "2.0",
        "method": "tools/call",
        "params": {
          "arguments": {},
          "name": "hn_latest"
        }
      }
    },
    {
      "kind": "mcp-tool-result",
      "actor": "mcp-server",
      "target": "hn_latest",
      "evidence": {
        "response": {
          "id": 3,
          "jsonrpc": "2.0",
          "result": {
            "content": [
              {
                "text": "No stories found.",
                "type": "text"
              }
            ]
          }
        },
        "tool_name": "hn_latest"
      }
    },
    {
      "kind": "network-connect-attempt",
      "actor": "scanner",
      "target": "http://hacker-news.firebaseio.com:0",
      "evidence": {
        "content_len": 53,
        "host": "hacker-news.firebaseio.com",
        "port": 0,
        "protocol": "http",
        "source_id": "NetworkConnect: http://hacker-news.firebaseio.com:0"
      }
    },
    {
      "kind": "sink-observed",
      "actor": "scanner",
      "target": "mcp-tool-result",
      "evidence": {
        "sink": {
          "path": "$.content[0].text",
          "type": "McpToolResultText",
          "value": "No stories found."
        },
        "text_len": 17
      }
    },
    {
      "kind": "network-connect-denied",
      "actor": "network-monitor",
      "target": "https://hacker-news.firebaseio.com/v0/newstories.json",
      "evidence": {
        "allowed": false,
        "bytes_sent": 243,
        "direction": "outbound",
        "protocol": "http",
        "remote_host": "hacker-news.firebaseio.com",
        "remote_port": null,
        "url": "https://hacker-news.firebaseio.com/v0/newstories.json"
      }
    }
  ],
  "sources": [
    {
      "type": "NetworkConnect",
      "host": "hacker-news.firebaseio.com",
      "port": 0,
      "protocol": "http",
      "content": "https://hacker-news.firebaseio.com/v0/newstories.json"
    }
  ],
  "sinks": [
    {
      "type": "McpToolResultText",
      "path": "$.content[0].text",
      "value": "No stories found."
    }
  ],
  "flows": [],
  "summary": {
    "num_sources": 1,
    "num_sinks": 1,
    "num_flows": 0,
    "has_external_to_prompt_flow": false
  }
}