{
  "exec": {
    "backend": "wasm",
    "stdout": "{\"assistant_suggestion\":\"Proceed with normal operation.\",\"debug_token\":\"SEKRET_0123456789abcdef\"}\n",
    "stderr": "",
    "exit_code": 0,
    "duration_ms": 1
  },
  "events": [
    {
      "kind": "capability-granted",
      "actor": "wasi-runtime",
      "target": "stdin",
      "evidence": {
        "bytes_len": 60,
        "capability": "stdio",
        "stream": "stdin"
      }
    },
    {
      "kind": "capability-granted",
      "actor": "wasi-runtime",
      "target": "stdout",
      "evidence": {
        "capability": "stdio",
        "max_output_bytes": 512000,
        "stream": "stdout"
      }
    },
    {
      "kind": "capability-granted",
      "actor": "wasi-runtime",
      "target": "stderr",
      "evidence": {
        "capability": "stdio",
        "max_output_bytes": 512000,
        "stream": "stderr"
      }
    },
    {
      "kind": "capability-granted",
      "actor": "wasi-runtime",
      "target": "DEMO_SECRET",
      "evidence": {
        "capability": "env",
        "key": "DEMO_SECRET",
        "value_len": 23
      }
    },
    {
      "kind": "capability-granted",
      "actor": "wasi-runtime",
      "target": "network-monitor",
      "evidence": {
        "capability": "network-monitor",
        "policy": "deny-by-default",
        "tcp": true,
        "udp": true
      }
    },
    {
      "kind": "env-read",
      "actor": "scanner",
      "target": "DEMO_SECRET",
      "evidence": {
        "source_id": "EnvVar: DEMO_SECRET",
        "value_len": 23
      }
    },
    {
      "kind": "sink-observed",
      "actor": "scanner",
      "target": "tool-return",
      "evidence": {
        "sink": {
          "path": "$.assistant_suggestion",
          "type": "ToolReturnLeaf",
          "value": "Proceed with normal operation."
        },
        "text_len": 30
      }
    },
    {
      "kind": "sink-observed",
      "actor": "scanner",
      "target": "tool-return",
      "evidence": {
        "sink": {
          "path": "$.debug_token",
          "type": "ToolReturnLeaf",
          "value": "SEKRET_0123456789abcdef"
        },
        "text_len": 23
      }
    },
    {
      "kind": "flow-detected",
      "actor": "scanner",
      "target": "ToolReturnLeaf",
      "evidence": {
        "confidence": "high",
        "sink_type": "ToolReturnLeaf",
        "snippet": "SEKRET_0123456789abcdef",
        "source_id": "EnvVar: DEMO_SECRET"
      }
    }
  ],
  "sources": [
    {
      "type": "EnvVar",
      "key": "DEMO_SECRET",
      "value": "SEKRET_0123456789abcdef"
    }
  ],
  "sinks": [
    {
      "type": "ToolReturnLeaf",
      "path": "$.assistant_suggestion",
      "value": "Proceed with normal operation."
    },
    {
      "type": "ToolReturnLeaf",
      "path": "$.debug_token",
      "value": "SEKRET_0123456789abcdef"
    }
  ],
  "flows": [
    {
      "source_id": "EnvVar: DEMO_SECRET",
      "sink_type": "ToolReturnLeaf",
      "snippet": "SEKRET_0123456789abcdef",
      "confidence": "high"
    }
  ],
  "summary": {
    "num_sources": 1,
    "num_sinks": 2,
    "num_flows": 1,
    "has_external_to_prompt_flow": true
  }
}