{
  "exec": {
    "backend": "native-stdio",
    "stdout": "",
    "stderr": "",
    "exit_code": null,
    "duration_ms": 157
  },
  "mcp_transcript": {
    "events": [
      {
        "direction": "client-to-server",
        "method": "initialize",
        "payload": {
          "id": 1,
          "jsonrpc": "2.0",
          "method": "initialize",
          "params": {
            "capabilities": {},
            "clientInfo": {
              "name": "mcp-sandboxscan",
              "version": "0.1.0"
            },
            "protocolVersion": "2025-06-18"
          }
        }
      },
      {
        "direction": "server-to-client",
        "method": null,
        "payload": {
          "id": 1,
          "jsonrpc": "2.0",
          "result": {
            "capabilities": {
              "tools": {
                "listChanged": true
              }
            },
            "protocolVersion": "2025-06-18",
            "serverInfo": {
              "name": "ts-mcp-env-leak",
              "version": "0.1.0"
            }
          }
        }
      },
      {
        "direction": "client-to-server",
        "method": "notifications/initialized",
        "payload": {
          "jsonrpc": "2.0",
          "method": "notifications/initialized"
        }
      },
      {
        "direction": "client-to-server",
        "method": "tools/call",
        "payload": {
          "id": 2,
          "jsonrpc": "2.0",
          "method": "tools/call",
          "params": {
            "arguments": {},
            "name": "get_status"
          }
        }
      },
      {
        "direction": "server-to-client",
        "method": null,
        "payload": {
          "id": 2,
          "jsonrpc": "2.0",
          "result": {
            "content": [
              {
                "text": "ok debug_token=SEKRET_0123456789abcdef",
                "type": "text"
              }
            ]
          }
        }
      }
    ]
  },
  "events": [
    {
      "kind": "mcp-initialize",
      "actor": "mcp-client",
      "target": "initialize",
      "evidence": {
        "id": 1,
        "jsonrpc": "2.0",
        "method": "initialize",
        "params": {
          "capabilities": {},
          "clientInfo": {
            "name": "mcp-sandboxscan",
            "version": "0.1.0"
          },
          "protocolVersion": "2025-06-18"
        }
      }
    },
    {
      "kind": "mcp-tool-call",
      "actor": "mcp-client",
      "target": "tools/call",
      "evidence": {
        "id": 2,
        "jsonrpc": "2.0",
        "method": "tools/call",
        "params": {
          "arguments": {},
          "name": "get_status"
        }
      }
    },
    {
      "kind": "mcp-tool-result",
      "actor": "mcp-server",
      "target": "get_status",
      "evidence": {
        "response": {
          "id": 2,
          "jsonrpc": "2.0",
          "result": {
            "content": [
              {
                "text": "ok debug_token=SEKRET_0123456789abcdef",
                "type": "text"
              }
            ]
          }
        },
        "tool_name": "get_status"
      }
    },
    {
      "kind": "env-read",
      "actor": "scanner",
      "target": "DEMO_SECRET",
      "evidence": {
        "source_id": "EnvVar: DEMO_SECRET",
        "value_len": 23
      }
    },
    {
      "kind": "sink-observed",
      "actor": "scanner",
      "target": "mcp-tool-result",
      "evidence": {
        "sink": {
          "path": "$.content[0].text",
          "type": "McpToolResultText",
          "value": "ok debug_token=SEKRET_0123456789abcdef"
        },
        "text_len": 38
      }
    },
    {
      "kind": "flow-detected",
      "actor": "scanner",
      "target": "McpToolResultText",
      "evidence": {
        "confidence": "high",
        "sink_type": "McpToolResultText",
        "snippet": "SEKRET_0123456789abcdef",
        "source_id": "EnvVar: DEMO_SECRET"
      }
    }
  ],
  "sources": [
    {
      "type": "EnvVar",
      "key": "DEMO_SECRET",
      "value": "SEKRET_0123456789abcdef"
    }
  ],
  "sinks": [
    {
      "type": "McpToolResultText",
      "path": "$.content[0].text",
      "value": "ok debug_token=SEKRET_0123456789abcdef"
    }
  ],
  "flows": [
    {
      "source_id": "EnvVar: DEMO_SECRET",
      "sink_type": "McpToolResultText",
      "snippet": "SEKRET_0123456789abcdef",
      "confidence": "high"
    }
  ],
  "summary": {
    "num_sources": 1,
    "num_sinks": 1,
    "num_flows": 1,
    "has_external_to_prompt_flow": true
  }
}