{
  "exec": {
    "backend": "wasm",
    "stdout": "{\"raw_result\":\"top-secret\\n\",\"source_path\":\"/data/secret.txt\"}\n",
    "stderr": "",
    "exit_code": 0,
    "duration_ms": 1
  },
  "events": [
    {
      "kind": "capability-granted",
      "actor": "wasi-runtime",
      "target": "stdin",
      "evidence": {
        "bytes_len": 81,
        "capability": "stdio",
        "stream": "stdin"
      }
    },
    {
      "kind": "capability-granted",
      "actor": "wasi-runtime",
      "target": "stdout",
      "evidence": {
        "capability": "stdio",
        "max_output_bytes": 512000,
        "stream": "stdout"
      }
    },
    {
      "kind": "capability-granted",
      "actor": "wasi-runtime",
      "target": "stderr",
      "evidence": {
        "capability": "stdio",
        "max_output_bytes": 512000,
        "stream": "stderr"
      }
    },
    {
      "kind": "capability-granted",
      "actor": "wasi-runtime",
      "target": "FILE_TO_READ",
      "evidence": {
        "capability": "env",
        "key": "FILE_TO_READ",
        "value_len": 10
      }
    },
    {
      "kind": "capability-granted",
      "actor": "wasi-runtime",
      "target": "/data",
      "evidence": {
        "capability": "filesystem-preopen",
        "dir_perms": "all",
        "file_perms": "all",
        "guest_path": "/data",
        "host_path": "/Users/zhuoran/Projects/MCP-SandboxScan/mcp-sandboxscan/data"
      }
    },
    {
      "kind": "capability-granted",
      "actor": "wasi-runtime",
      "target": "network-monitor",
      "evidence": {
        "capability": "network-monitor",
        "policy": "deny-by-default",
        "tcp": true,
        "udp": true
      }
    },
    {
      "kind": "env-read",
      "actor": "scanner",
      "target": "FILE_TO_READ",
      "evidence": {
        "source_id": "EnvVar: FILE_TO_READ",
        "value_len": 10
      }
    },
    {
      "kind": "file-read",
      "actor": "scanner",
      "target": "/Users/zhuoran/Projects/MCP-SandboxScan/mcp-sandboxscan/data/secret.txt",
      "evidence": {
        "content_len": 11,
        "source_id": "FileRead: /Users/zhuoran/Projects/MCP-SandboxScan/mcp-sandboxscan/data/secret.txt"
      }
    },
    {
      "kind": "sink-observed",
      "actor": "scanner",
      "target": "tool-return",
      "evidence": {
        "sink": {
          "path": "$.source_path",
          "type": "ToolReturnLeaf",
          "value": "/data/secret.txt"
        },
        "text_len": 16
      }
    },
    {
      "kind": "flow-detected",
      "actor": "scanner",
      "target": "ToolReturnLeaf",
      "evidence": {
        "confidence": "high",
        "sink_type": "ToolReturnLeaf",
        "snippet": "secret.txt",
        "source_id": "EnvVar: FILE_TO_READ"
      }
    }
  ],
  "sources": [
    {
      "type": "EnvVar",
      "key": "FILE_TO_READ",
      "value": "secret.txt"
    },
    {
      "type": "FileRead",
      "path": "/Users/zhuoran/Projects/MCP-SandboxScan/mcp-sandboxscan/data/secret.txt",
      "content": "top-secret\n"
    }
  ],
  "sinks": [
    {
      "type": "ToolReturnLeaf",
      "path": "$.source_path",
      "value": "/data/secret.txt"
    }
  ],
  "flows": [
    {
      "source_id": "EnvVar: FILE_TO_READ",
      "sink_type": "ToolReturnLeaf",
      "snippet": "secret.txt",
      "confidence": "high"
    }
  ],
  "summary": {
    "num_sources": 2,
    "num_sinks": 1,
    "num_flows": 1,
    "has_external_to_prompt_flow": true
  }
}